{
  "b32k_binding": {
    "assignment_artifact": "artifacts/json/structural_key_b32k_index_assignment_001.json",
    "binding_status": "complete",
    "bound_entry_count": 11,
    "boundary": "Indices are provisional symbolic addresses, not final semantic law.",
    "missing_key_count": 0,
    "missing_keys": [],
    "registry": "artifacts/json/structural_key_registry_001.json"
  },
  "book": "Genesis",
  "chapter": 1,
  "created": "2026-07-08T12:57:21",
  "entries": [
    {
      "admission_status": "creation initiated",
      "b32k_assignment_lane": "b32k.structural_key.v1",
      "b32k_assignment_status": "provisional_hash_assignment",
      "b32k_binding_status": "bound_to_structural_key_registry_001",
      "b32k_lane": "b32k.kjv.genesis",
      "b32k_symbol_index": 31830,
      "boundary_function": "first admissible distinction",
      "boundary_note": "Translation mythology with declared structural correlation. Not a hidden-code, doctrine-engine, or physics claim.",
      "confidence": "draft",
      "grammar_operation": "domain opened",
      "id": "genesis.001.001.creation",
      "keeper_line": "Creation begins as a boundary action.",
      "literal_layer": "God creates heaven and earth.",
      "memory_operation": "not yet explicit",
      "mythic_role": "first creative act",
      "notes": [],
      "physics_analogy": "domain initialization",
      "source": "Genesis 1:1",
      "source_phrase": "In the beginning God created the heaven and the earth.",
      "structural_function": "an action proceeds and draws a line around the physical",
      "structural_key": "BOUNDARY_ACTION",
      "thalean_role": "boundary before body",
      "witness_relation": "not yet explicit"
    },
    {
      "admission_status": "awaiting disclosure",
      "b32k_assignment_lane": "b32k.structural_key.v1",
      "b32k_assignment_status": "provisional_hash_assignment",
      "b32k_binding_status": "bound_to_structural_key_registry_001",
      "b32k_lane": "b32k.kjv.genesis",
      "b32k_symbol_index": 288,
      "boundary_function": "inside exists without assigned form",
      "boundary_note": "Translation mythology with declared structural correlation. Not a hidden-code, doctrine-engine, or physics claim.",
      "confidence": "draft",
      "grammar_operation": "pre-grammar condition",
      "id": "genesis.001.002.void_deep",
      "keeper_line": "The deep is the first unassigned inside.",
      "literal_layer": "Earth is formless and void, with darkness on the deep.",
      "memory_operation": "latent, not yet recorded",
      "mythic_role": "unformed depth",
      "notes": [],
      "physics_analogy": "pre-measurement field condition",
      "source": "Genesis 1:2",
      "source_phrase": "And the earth was without form, and void; and darkness was upon the face of the deep.",
      "structural_function": "a created domain exists before stable internal grammar",
      "structural_key": "UNASSIGNED_SUBSTRATE",
      "thalean_role": "unassigned substrate",
      "witness_relation": "the face of the deep makes depth encounterable"
    },
    {
      "admission_status": "witness present before naming",
      "b32k_assignment_lane": "b32k.structural_key.v1",
      "b32k_assignment_status": "provisional_hash_assignment",
      "b32k_binding_status": "bound_to_structural_key_registry_001",
      "b32k_lane": "b32k.kjv.genesis",
      "b32k_symbol_index": 3740,
      "boundary_function": "face-to-depth relation",
      "boundary_note": "Translation mythology with declared structural correlation. Not a hidden-code, doctrine-engine, or physics claim.",
      "confidence": "draft",
      "grammar_operation": "relation opened",
      "id": "genesis.001.002.spirit_moving",
      "keeper_line": "The thinkable other noticed the difference.",
      "literal_layer": "The Spirit moves upon the waters.",
      "memory_operation": "attention before record",
      "mythic_role": "first relation to the unformed domain",
      "notes": [],
      "physics_analogy": "observer boundary analogy",
      "source": "Genesis 1:2",
      "source_phrase": "And the Spirit of God moved upon the face of the waters.",
      "structural_function": "the thinkable other notices the difference",
      "structural_key": "FIRST_WITNESS_RELATION",
      "thalean_role": "witness before grammar",
      "witness_relation": "witness relation becomes active"
    },
    {
      "admission_status": "later judged good",
      "b32k_assignment_lane": "b32k.structural_key.v1",
      "b32k_assignment_status": "provisional_hash_assignment",
      "b32k_binding_status": "bound_to_structural_key_registry_001",
      "b32k_lane": "b32k.kjv.genesis",
      "b32k_symbol_index": 8865,
      "boundary_function": "disclosure",
      "boundary_note": "Translation mythology with declared structural correlation. Not a hidden-code, doctrine-engine, or physics claim.",
      "confidence": "draft",
      "grammar_operation": "enables division of light and darkness",
      "id": "genesis.001.003.light",
      "keeper_line": "Light is the first receipt.",
      "literal_layer": "Light appears.",
      "memory_operation": "receipt formation",
      "mythic_role": "first visibility",
      "notes": [],
      "physics_analogy": "measurement or readout, not photon claim",
      "source": "Genesis 1:3",
      "source_phrase": "And God said, Let there be light: and there was light.",
      "structural_function": "difference becomes readable record",
      "structural_key": "FIRST_RECEIPT",
      "thalean_role": "first receipt",
      "witness_relation": "record becomes available to witness"
    },
    {
      "admission_status": "judged good",
      "b32k_assignment_lane": "b32k.structural_key.v1",
      "b32k_assignment_status": "provisional_hash_assignment",
      "b32k_binding_status": "bound_to_structural_key_registry_001",
      "b32k_lane": "b32k.kjv.genesis",
      "b32k_symbol_index": 22622,
      "boundary_function": "light and darkness become separable",
      "boundary_note": "Translation mythology with declared structural correlation. Not a hidden-code, doctrine-engine, or physics claim.",
      "confidence": "draft",
      "grammar_operation": "division operation",
      "id": "genesis.001.004.good_division",
      "keeper_line": "The record was considered, admitted, and allowed to continue.",
      "literal_layer": "Light is seen as good and divided from darkness.",
      "memory_operation": "record is allowed to continue",
      "mythic_role": "judgment and separation",
      "notes": [],
      "physics_analogy": "state separation after readout",
      "source": "Genesis 1:4",
      "source_phrase": "And God saw the light, that it was good: and God divided the light from the darkness.",
      "structural_function": "the record is considered, admitted, and stabilized by distinction",
      "structural_key": "ADMITTED_DISTINCTION",
      "thalean_role": "admissibility after witness",
      "witness_relation": "witness evaluates the record"
    },
    {
      "admission_status": "first day completed",
      "b32k_assignment_lane": "b32k.structural_key.v1",
      "b32k_assignment_status": "provisional_hash_assignment",
      "b32k_binding_status": "bound_to_structural_key_registry_001",
      "b32k_lane": "b32k.kjv.genesis",
      "b32k_symbol_index": 26273,
      "boundary_function": "difference becomes named pair",
      "boundary_note": "Translation mythology with declared structural correlation. Not a hidden-code, doctrine-engine, or physics claim.",
      "confidence": "draft",
      "grammar_operation": "naming and cycle assignment",
      "id": "genesis.001.005.day_night",
      "keeper_line": "The admitted difference received a grammar.",
      "literal_layer": "Light and darkness are named Day and Night.",
      "memory_operation": "evening and morning form the first receipt cycle",
      "mythic_role": "first paired tokens",
      "notes": [],
      "physics_analogy": "clock-like cycle without full calendar yet",
      "source": "Genesis 1:5",
      "source_phrase": "And God called the light Day, and the darkness he called Night. And the evening and the morning were the first day.",
      "structural_function": "admitted difference receives grammar and cycle",
      "structural_key": "FIRST_GRAMMAR",
      "thalean_role": "grammar assignment",
      "witness_relation": "names make the record communicable"
    },
    {
      "admission_status": "it was so",
      "b32k_assignment_lane": "b32k.structural_key.v1",
      "b32k_assignment_status": "provisional_hash_assignment",
      "b32k_binding_status": "bound_to_structural_key_registry_001",
      "b32k_lane": "b32k.kjv.genesis",
      "b32k_symbol_index": 11595,
      "boundary_function": "waters are separated by an internal boundary",
      "boundary_note": "Translation mythology with declared structural correlation. Not a hidden-code, doctrine-engine, or physics claim.",
      "confidence": "draft",
      "grammar_operation": "Heaven named as chamber",
      "id": "genesis.001.006_008.firmament",
      "keeper_line": "Heaven is the first chamber.",
      "literal_layer": "The firmament divides waters above from waters below.",
      "memory_operation": "separation becomes place memory",
      "mythic_role": "first architecture",
      "notes": [],
      "physics_analogy": "field partition or boundary layer analogy",
      "source": "Genesis 1:6-8",
      "source_phrase": "Let there be a firmament in the midst of the waters, and let it divide the waters from the waters.",
      "structural_function": "record receives a chamber",
      "structural_key": "FIRST_CHAMBER",
      "thalean_role": "chamber grammar",
      "witness_relation": "the chamber makes above and below readable"
    },
    {
      "admission_status": "judged good",
      "b32k_assignment_lane": "b32k.structural_key.v1",
      "b32k_assignment_status": "provisional_hash_assignment",
      "b32k_binding_status": "bound_to_structural_key_registry_001",